{
  "catalog_id": "ATC-SYSTEM-REQUIREMENTS",
  "schema_version": "1.0.0",
  "document_status": "REQUIREMENTS_BASELINE",
  "generated_for_commit": "84588c54fbf5e48f2c08e8d7eab84b3dcdce4968",
  "rule": "Requirements are not evidence of implementation. Status may advance only with source, tests, and exact-SHA evidence.",
  "systems": [
    {
      "system_id": "SHIVACORE-KERNEL",
      "name": "ShivaCore Kernel",
      "canonical_repository": "globus-os",
      "canonical_path": "modules/atc-shivacore/kernel/",
      "purpose": "Capability-based no_std microkernel and trusted computing base.",
      "requirement_ids": [
        "SHIVACORE-KERNEL-BOOT-HAL",
        "SHIVACORE-KERNEL-MEMORY-VMM",
        "SHIVACORE-KERNEL-CAPABILITIES",
        "SHIVACORE-KERNEL-IPC-BUS",
        "SHIVACORE-KERNEL-SCHEDULER-LIFECYCLE",
        "SHIVACORE-KERNEL-SYSCALL-ABI",
        "SHIVACORE-KERNEL-FAULT-DIAGNOSTICS",
        "SHIVACORE-KERNEL-SECURE-BOOT-IDENTITY"
      ]
    },
    {
      "system_id": "ATC-BLOCKCHAIN",
      "name": "A-TownChain Blockchain",
      "canonical_repository": "a-townchain",
      "canonical_path": "/",
      "purpose": "Canonical ledger, transaction, block, state transition and node protocol.",
      "requirement_ids": [
        "ATC-BLOCKCHAIN-CHAIN-PARAMETERS",
        "ATC-BLOCKCHAIN-TRANSACTIONS-CRYPTO",
        "ATC-BLOCKCHAIN-MEMPOOL-ADMISSION",
        "ATC-BLOCKCHAIN-BLOCK-STATE-TRANSITION",
        "ATC-BLOCKCHAIN-CONSENSUS-INTEGRATION",
        "ATC-BLOCKCHAIN-STORAGE-RECOVERY",
        "ATC-BLOCKCHAIN-P2P-SYNC",
        "ATC-BLOCKCHAIN-RPC-OPERATIONS"
      ]
    },
    {
      "system_id": "ATC-VM",
      "name": "ATC-VM",
      "canonical_repository": "a-townchain",
      "canonical_path": "components/vm/",
      "purpose": "Canonical deterministic execution VM; atc-vm repository is specification/support unless governance changes SSOT.",
      "requirement_ids": [
        "ATC-VM-BYTECODE-FORMAT",
        "ATC-VM-DECODER-VERIFIER",
        "ATC-VM-EXECUTION-ENGINE",
        "ATC-VM-RESOURCES-GAS",
        "ATC-VM-HOST-ABI",
        "ATC-VM-STATE-ATOMICITY",
        "ATC-VM-CONFORMANCE"
      ]
    },
    {
      "system_id": "ATC-TOOLCHAIN",
      "name": "ATC-Toolchain",
      "canonical_repository": "atc-toolchain",
      "canonical_path": "/",
      "purpose": "Build orchestration, compiler pipeline, quality gates, artifact provenance and release packaging.",
      "requirement_ids": [
        "ATC-TOOLCHAIN-TOOLCHAIN-MANIFEST",
        "ATC-TOOLCHAIN-BUILD-GRAPH",
        "ATC-TOOLCHAIN-COMPILER-PIPELINE",
        "ATC-TOOLCHAIN-QUALITY-GATES",
        "ATC-TOOLCHAIN-VECTORS-REPRODUCIBILITY",
        "ATC-TOOLCHAIN-SUPPLY-CHAIN",
        "ATC-TOOLCHAIN-EVIDENCE-LIFECYCLE",
        "ATC-TOOLCHAIN-RELEASE-PACKAGING"
      ]
    },
    {
      "system_id": "ATC-STANDARDS",
      "name": "ATC-Standards",
      "canonical_repository": "atc-standards",
      "canonical_path": "/",
      "purpose": "Normative specifications, registries, compatibility and conformance governance.",
      "requirement_ids": [
        "ATC-STANDARDS-REGISTRY",
        "ATC-STANDARDS-NORMATIVE-LANGUAGE",
        "ATC-STANDARDS-ENCODING-CRYPTO",
        "ATC-STANDARDS-PROTOCOL-ABI",
        "ATC-STANDARDS-CONFORMANCE-VECTORS",
        "ATC-STANDARDS-CHANGE-GOVERNANCE",
        "ATC-STANDARDS-TRACEABILITY"
      ]
    },
    {
      "system_id": "ATC-ALGORITHM",
      "name": "ATC-Algorithm",
      "canonical_repository": "a-townchain",
      "canonical_path": "components/algorithm/",
      "purpose": "Canonical production consensus/algorithm implementation; atc-algorithm provides specs/governance/support.",
      "requirement_ids": [
        "ATC-ALGORITHM-ALGORITHM-REGISTRY",
        "ATC-ALGORITHM-DETERMINISTIC-CONTRACT",
        "ATC-ALGORITHM-ELIGIBILITY-LEADER",
        "ATC-ALGORITHM-FORK-FINALITY",
        "ATC-ALGORITHM-ECONOMICS",
        "ATC-ALGORITHM-SIMULATION-SECURITY"
      ]
    },
    {
      "system_id": "ATC-LANG",
      "name": "ATC-Lang / ATCLang",
      "canonical_repository": "atclang",
      "canonical_path": "/",
      "purpose": "Language specification and frontend; no separate VM/runtime authority.",
      "requirement_ids": [
        "ATC-LANG-GRAMMAR-LEXER",
        "ATC-LANG-PARSER-AST",
        "ATC-LANG-SEMANTIC-ANALYSIS",
        "ATC-LANG-LOWERING-BYTECODE",
        "ATC-LANG-STDLIB",
        "ATC-LANG-DEVELOPER-TOOLS"
      ]
    },
    {
      "system_id": "GLOBUS-OS",
      "name": "GlobusOS",
      "canonical_repository": "globus-os",
      "canonical_path": "/",
      "purpose": "Operating-system integration and services around the canonical ShivaCore kernel.",
      "requirement_ids": [
        "GLOBUS-OS-BOOT-LIFECYCLE",
        "GLOBUS-OS-KERNEL-INTEGRATION",
        "GLOBUS-OS-DRIVERS-HAL",
        "GLOBUS-OS-SERVICE-MANAGER",
        "GLOBUS-OS-FILESYSTEM-NETWORK",
        "GLOBUS-OS-EVENT-IPC",
        "GLOBUS-OS-IDENTITY-UPDATE",
        "GLOBUS-OS-AURORA-ISOLATION"
      ]
    },
    {
      "system_id": "AURORA-AI",
      "name": "Aurora-AI",
      "canonical_repository": "aurora-ai",
      "canonical_path": "/",
      "purpose": "AI models, training/inference and agent orchestration behind explicit policy and capability boundaries.",
      "requirement_ids": [
        "AURORA-AI-MODEL-DATA-REGISTRY",
        "AURORA-AI-TRAINING-EVALUATION",
        "AURORA-AI-INFERENCE-RUNTIME",
        "AURORA-AI-AGENT-ORCHESTRATION",
        "AURORA-AI-POLICY-CAPABILITY",
        "AURORA-AI-TOOL-SANDBOX",
        "AURORA-AI-EVALUATION-SECURITY",
        "AURORA-AI-DEPLOYMENT-ROLLBACK"
      ]
    },
    {
      "system_id": "GENESIS-ENGINE",
      "name": "Genesis Engine",
      "canonical_repository": "genesis-engine",
      "canonical_path": "/",
      "purpose": "Game-building/editor software and game runtime; project integration remains behind explicit interfaces.",
      "requirement_ids": [
        "GENESIS-ENGINE-PROJECT-EDITOR",
        "GENESIS-ENGINE-SCENE-WORLD",
        "GENESIS-ENGINE-ASSET-PIPELINE",
        "GENESIS-ENGINE-RENDERING",
        "GENESIS-ENGINE-INTERACTION-MEDIA",
        "GENESIS-ENGINE-SCRIPTING-PLUGINS",
        "GENESIS-ENGINE-BUILD-DEBUG",
        "GENESIS-ENGINE-INTEGRATION-BOUNDARY"
      ]
    }
  ],
  "requirements": [
    {
      "requirement_id": "SHIVACORE-KERNEL-BOOT-HAL",
      "system_id": "SHIVACORE-KERNEL",
      "system_name": "ShivaCore Kernel",
      "component_id": "boot-hal",
      "component_name": "Boot and HAL",
      "status": "REQUIRED",
      "canonical_repository": "globus-os",
      "canonical_path": "modules/atc-shivacore/kernel/",
      "requirement": "Boot phases, CPU discovery, architecture abstraction, interrupt/timer setup.",
      "acceptance_criteria": "Boot image, target, boot log and hardware/emulator evidence are pinned to exact SHA.",
      "implementation_evidence": null,
      "verification_evidence": null,
      "residuals": [
        "Source-to-symbol mapping, tests, and exact-SHA evidence must be established by audit."
      ]
    },
    {
      "requirement_id": "SHIVACORE-KERNEL-MEMORY-VMM",
      "system_id": "SHIVACORE-KERNEL",
      "system_name": "ShivaCore Kernel",
      "component_id": "memory-vmm",
      "component_name": "Memory and VMM",
      "status": "REQUIRED",
      "canonical_repository": "globus-os",
      "canonical_path": "modules/atc-shivacore/kernel/",
      "requirement": "Frame allocation, address spaces, page tables, mapping permissions, rollback, reclamation.",
      "acceptance_criteria": "Failed mapping mutations preserve invariants; mapping/object lifetimes have tests.",
      "implementation_evidence": null,
      "verification_evidence": null,
      "residuals": [
        "Source-to-symbol mapping, tests, and exact-SHA evidence must be established by audit."
      ]
    },
    {
      "requirement_id": "SHIVACORE-KERNEL-CAPABILITIES",
      "system_id": "SHIVACORE-KERNEL",
      "system_name": "ShivaCore Kernel",
      "component_id": "capabilities",
      "component_name": "Capability security",
      "status": "REQUIRED",
      "canonical_repository": "globus-os",
      "canonical_path": "modules/atc-shivacore/kernel/",
      "requirement": "Object identity, rights, derivation/restriction, transfer, validation and revocation model.",
      "acceptance_criteria": "Every privileged operation checks authority; no ambient authority.",
      "implementation_evidence": null,
      "verification_evidence": null,
      "residuals": [
        "Source-to-symbol mapping, tests, and exact-SHA evidence must be established by audit."
      ]
    },
    {
      "requirement_id": "SHIVACORE-KERNEL-IPC-BUS",
      "system_id": "SHIVACORE-KERNEL",
      "system_name": "ShivaCore Kernel",
      "component_id": "ipc-bus",
      "component_name": "IPCBus",
      "status": "REQUIRED",
      "canonical_repository": "globus-os",
      "canonical_path": "modules/atc-shivacore/kernel/",
      "requirement": "Capability-gated endpoints, bounded queues, message validation, cancellation and errors.",
      "acceptance_criteria": "Unauthorized and malformed messages fail closed; resource limits are tested.",
      "implementation_evidence": null,
      "verification_evidence": null,
      "residuals": [
        "Source-to-symbol mapping, tests, and exact-SHA evidence must be established by audit."
      ]
    },
    {
      "requirement_id": "SHIVACORE-KERNEL-SCHEDULER-LIFECYCLE",
      "system_id": "SHIVACORE-KERNEL",
      "system_name": "ShivaCore Kernel",
      "component_id": "scheduler-lifecycle",
      "component_name": "Scheduler and lifecycle",
      "status": "REQUIRED",
      "canonical_repository": "globus-os",
      "canonical_path": "modules/atc-shivacore/kernel/",
      "requirement": "Thread/process states, context switch, scheduling policy, blocking, wakeup and teardown.",
      "acceptance_criteria": "State transitions and cleanup are tested; no dangling mappings/resources.",